{
  "scene_id": "marinecity_000132",
  "timestamp": 103.25,
  "uav_group": ["UAV_1", "UAV_2", "UAV_3"],
  "object_id": "vehicle_021",
  "coarse_class": "vehicle",
  "fine_class": "ambulance",
  "ambiguity_type": "van_vs_ambulance",
  "missing_evidence": ["side marking", "roof light bar", "vehicle side profile"],
  "recommended_next_view": {
    "view_type": "right_oblique",
    "altitude": 80,
    "reason": "side markings and roof light bar are not visible from top view"
  },
  "views": [
    {
      "uav_id": "UAV_1",
      "view_type": "nadir",
      "altitude": 150,
      "image_path": "images/scene_000132/uav1_rgb.png",
      "depth_path": "depth/scene_000132/uav1_depth.npy",
      "bbox_2d": [512, 331, 529, 348],
      "camera_pose": "poses/scene_000132/uav1_pose.json",
      "width": 1920,
      "height": 1080
    },
    {
      "uav_id": "UAV_2",
      "view_type": "right_oblique",
      "altitude": 90,
      "image_path": "images/scene_000132/uav2_rgb.png",
      "depth_path": "depth/scene_000132/uav2_depth.npy",
      "bbox_2d": [244, 420, 288, 462],
      "camera_pose": "poses/scene_000132/uav2_pose.json",
      "width": 1920,
      "height": 1080
    }
  ],
  "location_3d": [0.0, 0.0, 0.0],
  "occlusion_level": "partial",
  "difficulty": "hard"
}
